03/07/2003 20:15,7/3/2003,20:15,Colchester (UK/England),Colchester ,#N/A,,illuminated object very high in the atmosphere moving extremely quickly like a shooting star but in a lazy S shaped path.
03/07/2003 01:45,7/3/2003,01:45,Bristol (UK/England),Bristol ,#N/A,,l saw a flash in the night sky
03/03/2003 12:15,3/3/2003,12:15,Sheffield (UK/England),Sheffield ,#N/A,,date 3 3 03 cone shape moving up and slow at altitude 300ft above moving south
03/02/2003 14:00,2/3/2003,14:00,"Blackpool, Lancashire (UK/England)",Blackpool,Lancashire,,"Blackpool,Lancs,(UK-England) Cylinder"
03/02/2003 14:00,2/3/2003,14:00,Bristol (UK/England),Bristol ,#N/A,,white cigar shaped object
02/27/2003 07:00,27/2/2003,07:00,Somerset (UK/England),Somerset ,#N/A,,We saw a UFO in Bridgwater Somerset UK
02/23/2003 06:30,23/2/2003,06:30,Oswestry (UK/England),Oswestry ,#N/A,,"Egg shaped object travelling about 100 to 150 m.p.h flying below 1000ft, I was about a mile away from object."
02/21/2003 02:20,21/2/2003,02:20,UK/Scotland,UK/Scotland,#N/A,,In a clear sky the Star shone bright with what appeared to be white glowing fireflys buzzing aroung it.
02/15/2003 20:30,15/2/2003,20:30,Birmingham (UK/England),Birmingham ,#N/A,,My sister Kate and her family were looking out of a window in the family home at what they thought was a particularly bright star in th
02/15/2003 07:45,15/2/2003,07:45,Leicester (UK/England),Leicester ,#N/A,,looked up to see a lit up patch in the sky. An almost giant plane (football pitch size) went through the gap where the light was. my fr
02/12/2003 02:30,12/2/2003,02:30,Slough (UK/England),Slough ,#N/A,,Orb of light Observed
02/01/2003 18:00,1/2/2003,18:00,Doncaster (UK/England),Doncaster ,#N/A,,red fire ball free falling and disaperd
01/28/2003 18:30,28/1/2003,18:30,St. Albans (UK/England),St. Albans ,#N/A,,flashing lights at night not moving.
01/28/2003 14:08,28/1/2003,14:08,London (UK/England),London ,#N/A,,strange disk shapes in opening of clouds
01/24/2003 18:35,24/1/2003,18:35,Dover (UK/England),Dover ,#N/A,,Definite sighting by 2 professional people of craft travelling N.E to S.W. in view 30 secs
01/24/2003 03:20,24/1/2003,03:20,Stoke-on-Trent (UK/England),Stoke-on-Trent ,#N/A,,Sighting first by my husband a 100% life long sceptic he awoke me to see the unusual sightquite high above the horizon over farmland/fo
01/23/2003 23:22,23/1/2003,23:22,UK/England,UK/England,#N/A,,It was bright with a red haze and bright lines waving around it.
01/17/2003 20:50,17/1/2003,20:50,Accrington (UK/England),Accrington ,#N/A,,slowly moving fireball in the sky
01/17/2003 15:00,17/1/2003,15:00,"Leyland, Lancashire (UK/England)",Leyland,Lancashire,,"Video film taken of daylight object with fire and smoke contrail, moving upward at 30 degrees. Object was circular shaped."
01/14/2003 18:45,14/1/2003,18:45,Northampton (UK/England),Northampton ,#N/A,,"Cluster of intense bluish white flashing lights, no 'solid' object visible."
01/14/2003 16:15,14/1/2003,16:15,Plymouth (UK/England),Plymouth ,#N/A,,"strange round lights in the sky, amazingly bright even in daylight."
01/07/2003 06:45,7/1/2003,06:45,Bangor (UK/Wales) (north Wales),Bangor  ,#N/A,,Two very very bright lights white/blue in colour which were going around each other and then disapeared
01/06/2003 16:00,6/1/2003,16:00,"Kirkham, Preston (UK/England)",Kirkham,#N/A,,"Circular, silver, metallic, shiny object, no bigger than a football, moving at a steady speed,"
01/04/2003 22:00,4/1/2003,22:00,Northampton (UK/England),Northampton ,#N/A,,"very strange! looked out window, saw vey fast object totaly silent go across the sky. same night as eathquake in England."
01/03/2003 21:00,3/1/2003,21:00,Edinburgh (UK/England),Edinburgh ,#N/A,,flashing brightly
01/01/2003 00:20,1/1/2003,00:20,Brighton (UK/England),Brighton ,#N/A,,it moved slowly across the sky and suddenly zoomed off so all of us ran out side and the ufo glowed brighter like a star and hovered ov
01/01/2003 00:05,1/1/2003,00:05,Grimsby (UK/England),Grimsby ,#N/A,,light flys over Grimsby for 1 minute before disappearing
12/30/2002 10:00,30/12/2002,10:00,London (UK/England),London ,#N/A,,"i was visiting my grandmas on on new years in 2002, we were playing cards in the living room and becouse of the smoke, i left the room"
12/28/2002 19:10,28/12/2002,19:10,Stoke-on-Trent (UK/England),Stoke-on-Trent ,#N/A,,Red m Shaped Crafts flying in an upside down V formation
12/26/2002 07:05,26/12/2002,07:05,Manchester (UK/England),Manchester ,#N/A,,small object that turned towards me/ strong headlights- too low for plane
12/26/2002 06:55,26/12/2002,06:55,London (South East) (UK/England),London  ,#N/A,,Saw a very bright stationary light alaso witnessed by my husband. The light suddenly disappeared after a few minutes.
12/25/2002 00:00,25/12/2002,00:00,London (UK/England),London ,#N/A,,4 ships burning up.
12/24/2002 05:25,24/12/2002,05:25,Doncaster (UK/England),Doncaster ,#N/A,,VERY BIG BRIGHT PINK LIGHT (VERY UNUSUAL COLOUR)
12/19/2002 06:30,19/12/2002,06:30,Ystradgynlais (UK/Wales),Ystradgynlais ,#N/A,,One teardrop-shaped object silently streaked across the sky trailing a fiery plume.
12/19/2002 06:20,19/12/2002,06:20,London (UK/England),London ,#N/A,,"Moving very fast east to west, diamond shaped with long tail, definately not natural."
12/17/2002 22:56,17/12/2002,22:56,Congerstone (UK/England),Congerstone ,#N/A,,"The sky was bright over the fields we could see the northern lights.To our right hovering in the air stationary, just hanging in the ai"
12/15/2002 01:00,15/12/2002,01:00,United Kingdom (location unspecified),United Kingdom ,#N/A,,"In the winter of 2002, me and my father toke a interest in ufo spotting, using different things to contact them e.g powerful torchs, we"
12/12/2002 22:20,12/12/2002,22:20,Maidstone (UK/England),Maidstone ,#N/A,,one of the objects seemed to crash land.
12/12/2002 06:00,12/12/2002,06:00,Somerset (UK/England),Somerset ,#N/A,,"one disk, with bright lights over my house"
12/11/2002 20:56,11/12/2002,20:56,Leeds (UK/England),Leeds ,#N/A,,"4 lights,in formation,changing directions and formations,then leaving."
12/07/2002 14:00,7/12/2002,14:00,,,#N/A,,It was round made nosies I saw it uabove the sky.
12/04/2002 18:00,4/12/2002,18:00,West Molesey (UK/England),West Molesey ,#N/A,,Stange light seen near Heathrow airport.
12/03/2002 23:30,3/12/2002,23:30,Llandrindod Wells (UK/Wales),Llandrindod Wells ,#N/A,,My friend noticed that it was clear night and as she lives in rural locastion with little light polution she decided to view the stars
11/29/2002 19:30,29/11/2002,19:30,Canterbury (UK/England),Canterbury ,#N/A,,It was glowing it was a saucer it was yellow and had a white top.
11/26/2002 18:00,26/11/2002,18:00,Derbyshire (UK/England),Derbyshire ,#N/A,,Large bright single light in west of sky above derbyshire England
11/26/2002 17:45,26/11/2002,17:45,Titchfield (UK/England),Titchfield ,#N/A,,big red lights flashing.
11/24/2002 20:00,24/11/2002,20:00,Manchester (UK/England),Manchester ,#N/A,,manchester airport
11/17/2002 19:30,17/11/2002,19:30,Birmingham (UK/England),Birmingham ,#N/A,,I arrived from work quite late parked my van outside my home and as always on a clear cloudless night I look up at the stars. I was loo
11/15/2002 01:03,15/11/2002,01:03,Coventry (UK/England),Coventry ,#N/A,,as i was watching the stars in the sky as i was walking home for the night i saw something shoot across the sky.... of which i belived
11/15/2002 00:45,15/11/2002,00:45,"SWADLINCOTE DERBY, UK (NEAR)",SWADLINCOTE DERBY,#N/A,,SIGHTING NEAR SWADLINCOTE DERBYSHIRE
11/15/2002 00:02,15/11/2002,00:02,Walsall (UK/England),Walsall ,#N/A,,Hovering orange light that quickly accelerates and disappears
11/12/2002 23:00,12/11/2002,23:00,Lincolnshire (UK/England),Lincolnshire ,#N/A,,I saw a bright sec of light bobbing up and down in the night sky at around 11.00p.m
11/11/2002 18:40,11/11/2002,18:40,Wolverhampton (UK/England),Wolverhampton ,#N/A,,Formation Flight of two craft
11/10/2002 22:55,10/11/2002,22:55,"Southmore, Oxforshire (UK/England)",Southmore,#N/A,,Flash of billiant large white light Oxfordshire
11/07/2002 20:10,7/11/2002,20:10,Castleford Nr Leeds,Castleford Nr Leeds,#N/A,,"While walking my dog on a cold clear night, I saw a large Fireball travelled east to west at fantastic speed."
11/05/2002 13:30,5/11/2002,13:30,London (UK/England),London ,#N/A,,It was a scary shape going faster than anything I had ever seen in my life
10/27/2002 17:00,27/10/2002,17:00,Dundee (UK/Scotland),Dundee ,#N/A,,Whilst at work I looked out of the main door & saw what looked a cloud in the shape of a cigar which was white in colour. The object wa
10/24/2002 21:00,24/10/2002,21:00,Cheltenham (UK/England),Cheltenham ,#N/A,,GREEN LIGHT BALLS CHASING EACH OTHER
10/24/2002 11:00,24/10/2002,11:00,Rotherham (UK/England),Rotherham ,#N/A,,Round whitish reflective ufo followed by military helicopter not long after sighting
10/18/2002 20:35,18/10/2002,20:35,Manchester (UK/England),Manchester ,#N/A,,"Saw a triangular object at night with 3 red lights on the corners, flashing in a regular pattern. The lights appeared to be right up to"
10/17/2002 01:45,17/10/2002,01:45,"Ditcot, Oxordshire (UK/England)",Ditcot,#N/A,,From around 1:15 am to 2:00 am this morning 17/10/2002 I watched a circular light moving at a speed far greater than any aircraft known
10/17/2002 01:45,17/10/2002,01:45,"South Stoke, Goring (UK/England)",South Stoke,#N/A,,"UFO sighted over fields and River Thames in South Stoke, Nr. Reading, UK"
10/16/2002 15:00,16/10/2002,15:00,Glasgow (UK/Scotland),Glasgow ,#N/A,,I am a Buyer with Scottish Water working in Glasgow and after a meeting with a supplier on Wednesday 16th October I happened to glance
10/15/2002 22:30,15/10/2002,22:30,"Slough, Berksire (UK/England)",Slough,Berkshire,,There was just rotating white lights in the sky moving back and fourth at speed.
10/14/2002 20:00,14/10/2002,20:00,Newcastle-upon-Tyne (UK/England),Newcastle-upon-Tyne ,#N/A,,"The object swayed and suddenly dropped, then made of circular motions,with the coloured lights circling it in no particular sequence"
10/12/2002 19:45,12/10/2002,19:45,Rotherham (UK/England),Rotherham ,#N/A,,Strange light in the sky
10/09/2002 19:30,9/10/2002,19:30,Sunderland (UK/England),Sunderland ,#N/A,,THATS WHAT I SAW
10/07/2002 16:53,7/10/2002,16:53,Huddersfield (UK/England),Huddersfield ,#N/A,,Dark coloured round disc
10/07/2002 00:00,7/10/2002,00:00,Doncaster (UK/England),Doncaster ,#N/A,,fast moving red ball of light.
10/04/2002 07:20,4/10/2002,07:20,Glasgow (UK/Scotland),Glasgow ,#N/A,,Rolling white diamond above hills
09/29/2002 21:40,29/9/2002,21:40,Colchester (UK/England),Colchester ,#N/A,,triangular light pattern seen in sky.
09/29/2002 07:30,29/9/2002,07:30,London (UK/England),London ,#N/A,,"4 angular brown objects moving in straight path, each with smaller areas that constantly changed"
09/26/2002 20:30,26/9/2002,20:30,Warminster (UK/England),Warminster ,#N/A,,"This object changed shape and colour, and moved unlike anything I have ever seen."
09/26/2002 16:00,26/9/2002,16:00,Middlesbrough (UK/England),Middlesbrough ,#N/A,,3 witnesses to sighting of 7-9 silver/white spheres/teardrops slowly moving into 'V' formation then dispersing in diff. directions
09/23/2002 06:15,23/9/2002,06:15,Swindon (UK/England),Swindon ,#N/A,,One thing before I start I must tell you that I am unsure of the date I saw the craft or object but I am sure it was late september ear
09/23/2002 01:00,23/9/2002,01:00,London (UK/England),London ,#N/A,,"Bright light and triangle over London, 23rd September 02, 1am"
09/17/2002 21:45,17/9/2002,21:45,Swindon (UK/England),Swindon ,#N/A,,Very bright white disk shaped object hovered then shot upwards in an arc
09/16/2002 21:30,16/9/2002,21:30,Coventry/Warwick (UK/England),Coventry/Warwick ,#N/A,,diamond shaped craft with coloured lights underneath.
09/15/2002 11:30,15/9/2002,11:30,Chichester (UK/England),Chichester ,#N/A,,sussex englands sighting
09/13/2002 20:45,13/9/2002,20:45,Manchester (UK/England),Manchester ,#N/A,,We saw a oval shaped craft flying at about 5 thousand ft high and traveling about 500 mph from east to west displaying flashing lights
09/13/2002 17:15,13/9/2002,17:15,London (UK/England),London ,#N/A,,Pulsating light over central London last Friday evening circa 17.15 -30
09/11/2002 21:00,11/9/2002,21:00,Worcestershire (UK/England),Worcestershire ,#N/A,,i was driving my truck on the M5 motorway in wocestershire in uk about around 21.00 on the 11.9.02 heading south and on the left of me
09/10/2002 11:15,10/9/2002,11:15,Peterborough (UK/England),Peterborough ,#N/A,,Egg shaped craft rising behind cloud in broad daylight
09/02/2002 02:20,2/9/2002,02:20,Peterborough (UK/England),Peterborough ,#N/A,,Bright Flashing light that disappeared after bright flash.
09/01/2002 23:34,1/9/2002,23:34,Norwich (UK/England),Norwich ,#N/A,,"white object with green and red lights all the way round blinking in sequence. Oval like shape, with a low hummmmm sound"
09/01/2002 23:00,1/9/2002,23:00,Leeds (UK/England),Leeds ,#N/A,,Diamond craft - lights on bottom and top
08/29/2002 22:00,29/8/2002,22:00,"Bridgewater, Somerset (UK/England)",Bridgewater,#N/A,,Light hovering silently in sky
08/28/2002 22:30,28/8/2002,22:30,Plymouth (near) (UK/England),Plymouth  ,#N/A,,"Moving light stops, flashes"
08/27/2002 22:30,27/8/2002,22:30,Cardiff (near) (UK/Wales),Cardiff  ,#N/A,,Stacked pulsating lights
08/23/2002 21:10,23/8/2002,21:10,Blackpool (UK/England),Blackpool ,#N/A,,strange lights in the sky
08/22/2002 21:45,22/8/2002,21:45,Shropham Norfolk (UK/England),Shropham Norfolk ,#N/A,,Bright Yellow/Orange Lights hovering and following car for 4 Miles.Photos of lights obtained after arriving home.
08/20/2002 23:53,20/8/2002,23:53,Birmingham (UK/England),Birmingham ,#N/A,,"My old friend told me that he saw the similar sighting, now i believe him 100%."
08/18/2002 23:08,18/8/2002,23:08,Preston (UK/England),Preston ,#N/A,,"1 triangle shaped craft,big,to far to see what colour .moved in ziping motion.ps one object may have been droped."
08/16/2002 22:34,16/8/2002,22:34,New Park (near the new forest) (UK/England),New Park  ,#N/A,,triangular object sighted with lights 70 feet above tree tops.
08/15/2002 19:00,15/8/2002,19:00,Cheshire (UK/England),Cheshire ,#N/A,,Fireball like objectin the sky
08/15/2002 17:00,15/8/2002,17:00,Bristol,Bristol,Somerset,,"At times it was pyramid shaped, but the shape changed as it rotated in the sky."
08/13/2002 22:30,13/8/2002,22:30,Luton (UK/England),Luton ,#N/A,,lights changing direction
08/12/2002 23:20,12/8/2002,23:20,London (Near) (UK/England),London  ,#N/A,,"Regular flashing light moving through the sky over the UK like a normal satellite, but clearly flashing on and off 30 times."
08/12/2002 23:15,12/8/2002,23:15,Nottingham (UK/England),Nottingham ,#N/A,,"Two sphere shaped objects chasing and then dancing across the sky, yellow/orange in colour."
08/12/2002 23:15,12/8/2002,23:15,Conisbrough (DONCASTER) (UK/England),Conisbrough  ,#N/A,,"A bright , round light, moving slowly before fading and disappearing"
08/12/2002 23:15,12/8/2002,23:15,Rugby (UK/England),Rugby ,#N/A,,Multiple triangular lights moving in V formation.
08/12/2002 22:58,12/8/2002,22:58,Rayleigh Essex (UK/England),Rayleigh Essex ,#N/A,,3 chevron/boomerang shaped craft in formation totally silent.
08/12/2002 22:45,12/8/2002,22:45,Coventry (UK/England),Coventry ,#N/A,,"2 dark grey craft, no sound, no lights, moving very fast across the sky."
08/12/2002 22:15,12/8/2002,22:15,Chelmsford (UK/England),Chelmsford ,#N/A,,"12th August 02 - Chelmsford, England Slow moving object with amazing manoeuvring capabilities"
08/12/2002 22:12,12/8/2002,22:12,Rochester (UK/England),Rochester ,#N/A,,triangular shape of lights cross sky over English town
08/12/2002 20:30,12/8/2002,20:30,Pontefract (UK/England),Pontefract ,#N/A,,Last night at 8.30pm I filmed a UFO with my camcorder.The footage I got was very clear. A saucer shaped object moving slowly.It was
08/12/2002 17:50,12/8/2002,17:50,Coventry (UK/England),Coventry ,#N/A,,"The ""craft"" I sighted was powered and it moved as though under precise guidance at an estimated speed of well over a 1,000 mph."
08/12/2002 01:30,12/8/2002,01:30,Northampton (UK/England),Northampton ,#N/A,,"1 bright light in the sky started to move,changed shape and speed,it then changed direction and shape and had flashing colour lights"
08/10/2002 01:00,10/8/2002,01:00,Gloucester (UK/England),Gloucester ,#N/A,,triangular object sighted in u.k
08/09/2002 00:36,9/8/2002,00:36,Liverpool (UK/England),Liverpool ,#N/A,,its as if thier just watching us.
08/08/2002 12:30,8/8/2002,12:30,Nottingham (UK/England),Nottingham ,#N/A,,"objects flashing lights in a randomly motion as though moving at the same time, not realising that the big bright light i thought was a"
08/03/2002 15:10,3/8/2002,15:10,Morecambe (UK/England),Morecambe ,#N/A,,3 silver objets very close to the sun very small but moving slowly away watched them for about 15/20 mins
07/31/2002 23:30,31/7/2002,23:30,Shropham Norfolk (UK/England),Shropham Norfolk ,#N/A,,Bright yellow/orange light hovering low in the sky that then re-appeared in another area of the sky at rapid speed.
07/30/2002 16:30,30/7/2002,16:30,,,#N/A,,"A large liquid shape, constantly changing. Seen in daylight in good conditions."
07/29/2002 20:00,29/7/2002,20:00,Sidmouth (UK/England),Sidmouth ,#N/A,,Flying Rod
07/28/2002 23:50,28/7/2002,23:50,London (UK/England),London ,#N/A,,"Blue/orange tinted bright fireball shooting across sky over West London, heading South to North before burning up."
07/28/2002 23:38,28/7/2002,23:38,Kirton Lindsey (UK/England),Kirton Lindsey ,#N/A,,"I observed a dark green, disk shaped object, with a bead of light around it, which I could not give a rational explanation to."
07/28/2002 22:08,28/7/2002,22:08,Worcestershire (UK/England),Worcestershire ,#N/A,,slow moving light sped up suddenly made no noise
07/27/2002 21:15,27/7/2002,21:15,Derby (UK/England),Derby ,#N/A,,"Been in the garden all day,at sunset the sky looked od so I got my dig cam and took a pic.on the pic there are 2 objects in the sky,one"
07/27/2002 18:00,27/7/2002,18:00,Avebury (UK/England),Avebury ,#N/A,,Cluster of oval UFO's by crop circles
07/26/2002 22:15,26/7/2002,22:15,Colchester (UK/England),Colchester ,#N/A,,I was sitting in my back yard with my wife and daughter as it was a nice evening and we had been watching various aircraft on approach
07/26/2002 00:30,26/7/2002,00:30,Richmond (UK/England),Richmond ,#N/A,,Bright fast light
07/25/2002 23:30,25/7/2002,23:30,Sidmouth (UK/England),Sidmouth ,#N/A,,Flying Light
07/24/2002 04:00,24/7/2002,04:00,Glenrothes (UK/Scotland),Glenrothes ,#N/A,,Two very bright lights in the sky they where both hovering together then one craft left the other one it went stright then stopped and
07/23/2002 00:15,23/7/2002,00:15,London (UK/England),London ,#N/A,,"Triangular formation of lights over North London , England"
07/22/2002 21:30,22/7/2002,21:30,London (UK/England),London ,#N/A,,Cylindrical craft sighted in London.
07/20/2002 00:00,20/7/2002,00:00,Skegness (UK/England),Skegness ,#N/A,,Star like craft emmits two red orbs
07/17/2002 14:30,17/7/2002,14:30,Liverpool (UK/England),Liverpool ,#N/A,,A CYLINDER SHAPED OBJECT THAT CLIMED 3000ft IN A MATTER OF SECONDS
07/16/2002 10:30,16/7/2002,10:30,UK/Scotland,UK/Scotland,#N/A,,Subj: Fwd: UFO Sighting in Scotland 16-7-2002 Date: 7/18/2002 9:51:17 AM Pacific Daylight Time From: yachtillusion@hotmail.com Sent fro
07/16/2002 00:10,16/7/2002,00:10,Lemington (UK/England),Lemington ,#N/A,,"Low flying square ufo seen over Lemington, England, passed over twice and had a main beam."
07/15/2002 05:00,15/7/2002,05:00,Hastings (UK/England),Hastings ,#N/A,,slow moving bright ball of light like a white flair
07/15/2002 03:20,15/7/2002,03:20,Worthing (UK/England),Worthing ,#N/A,,White light diamond shape moving from west to east along the south coast.Light was continuously moving in various directions and no tra
07/14/2002 17:00,14/7/2002,17:00,Edgeworth (near Bolton) (UK/England),Edgeworth  ,#N/A,,Disk caught on digital cam noticed day after.
07/13/2002 01:50,13/7/2002,01:50,Newcastle-upon-Tyne (UK/England),Newcastle-upon-Tyne ,#N/A,,I was driving back to my base in my Truck I was looking to the sky to my right when I saw what I thought was the headlights of a plane
07/12/2002 00:30,12/7/2002,00:30,Liverpool (UK/England),Liverpool ,#N/A,,I walked out of my front door to go to work somthing made me look up at the stars i was puzzeled at what seemed to be three very bright
07/10/2002 03:00,10/7/2002,03:00,Greater Manchester Area,Greater Manchester Area,#N/A,,"Black triangular craft was hovering over my town area for over half an hour, it looked to be inspecting or looking for something."
07/10/2002 01:00,10/7/2002,01:00,UK/England,UK/England,#N/A,,triangular shape object
07/07/2002 23:46,7/7/2002,23:46,Malton (UK/England),Malton ,#N/A,,it was sunday night and i had just turned the tv off and i heard something out side when i looked there where 3 bright disks in the dis
07/02/2002 23:40,2/7/2002,23:40,Formby (UK/England),Formby ,#N/A,,it was a large triangular object
06/30/2002 17:44,30/6/2002,17:44,Ipswich (UK/England),Ipswich ,#N/A,,Dark grey streak rapidly moving across scene.
06/30/2002 15:00,30/6/2002,15:00,Leicester (UK/England),Leicester ,#N/A,,"Again unsure of exact date & time. Think I was on my way to Mums w/ husband, staring out car window, going past Meridian."
06/27/2002 23:45,27/6/2002,23:45,Chelmsford (UK/England),Chelmsford ,#N/A,,very strange noise out side like somthing firing . like a rocket rocket.
06/26/2002 10:30,26/6/2002,10:30,Airdrie (UK/Scotland),Airdrie ,#N/A,,PHOTO OF UFO
06/23/2002 21:00,23/6/2002,21:00,London (UK/England),London ,#N/A,,Dark shaped object with very long stream of yellow flame coming from underneath it.
06/23/2002 03:00,23/6/2002,03:00,Luton (UK/England),Luton ,#N/A,,ball rise out of the trees and hoverd then change to a disk it then strobed black and blue makeing it look like a bird hover from a dis
06/22/2002 22:45,22/6/2002,22:45,Bristol (UK/England),Bristol ,#N/A,,"fireball moving very quick,entered the atmasphere,"
06/21/2002 23:15,21/6/2002,23:15,Whitstable (UK/England),Whitstable ,#N/A,,"Did not personally see, local radio reported hundreds along the coast around Whitstable, Herne Bay and Margate had seen the sighting. L"
06/20/2002 15:00,20/6/2002,15:00,Nottinghamshire (UK/England),Nottinghamshire ,#N/A,,Shape changing silent craft witnessed over local fields.
06/11/2002 16:45,11/6/2002,16:45,Johnstone (near Haverfordwest) (UK/England),Johnstone  ,#N/A,,"Rectangle object in sky seen in Wales, UK"
06/10/2002 09:30,10/6/2002,09:30,Portchester (UK/England),Portchester ,#N/A,,green light from clouds
06/08/2002 23:00,8/6/2002,23:00,UK/England,UK/England,#N/A,,it was late when me and my dad went out meteor looking! we went out as far from the lights as we could and we'd been there about 15 min
06/08/2002 21:07,8/6/2002,21:07,UK/England,UK/England,#N/A,,"Double diamond, mottled brown in colour, 8 feet long."
06/01/2002 22:00,1/6/2002,22:00,London (NW) (UK/England),London  ,#N/A,,what the ...
06/01/2002 15:00,1/6/2002,15:00,Sunderland,Sunderland,Tyne & Wear,,Silent fast moving UFO soon followed by 2 scrambled jets
06/01/2002 09:50,1/6/2002,09:50,Newport (UK/England),Newport ,#N/A,,"large object, ballon or parachute shaped appearence very high but slow moving."
05/31/2002 23:05,31/5/2002,23:05,Swansea (UK/England),Swansea ,#N/A,,Light Night
05/27/2002 08:17,27/5/2002,08:17,Llanfairfechan (UK/Wales),Llanfairfechan ,#N/A,,Saw a bright light in the sky
05/12/2002 00:30,12/5/2002,00:30,London (UK/England),London ,#N/A,,Very bright light falling from the sky then stopping in mid air and shooting off into the horizon
05/08/2002 21:00,8/5/2002,21:00,Derby (UK/England),Derby ,#N/A,,orange semi circle
05/04/2002 23:45,4/5/2002,23:45,"Exmouth, Devonshire (UK/England)",Exmouth,Devon,,the saucer or disk danced around in the sky dropping clear white dots of some sort .
05/01/2002 23:05,1/5/2002,23:05,Birmingham (UK/England),Birmingham ,#N/A,,objects that appear as stars 'dancing' in the sky.
04/26/2002 00:20,26/4/2002,00:20,Brighton (UK/England),Brighton ,#N/A,,Problems flying
04/21/2002 04:00,21/4/2002,04:00,Manchester (UK/England),Manchester ,#N/A,,We went outside to watch the conjuction of the planets.we did not see the conjuction as it is only visable at dusk.I focused on a fixed
04/19/2002 21:30,19/4/2002,21:30,Hemel Hempstead (UK/England),Hemel Hempstead ,#N/A,,big red object flew by me.
04/19/2002 03:15,19/4/2002,03:15,UK/England,UK/England,#N/A,,Glow on the moon
04/13/2002 21:55,13/4/2002,21:55,Leicester (UK/England),Leicester ,#N/A,,On the 13 April 2002 i witnessed 7 spheres circuling each other in many different directions where i got out of the house which they we
04/10/2002 22:00,10/4/2002,22:00,Newcastle (UK/England),Newcastle ,#N/A,,Road sighting
04/08/2002 11:50,8/4/2002,11:50,Oldham (UK/England),Oldham ,#N/A,,oval light
04/06/2002 22:10,6/4/2002,22:10,"Preston, Lancashire (UK/England)",Preston,Lancashire,,One big bright light travelling from west to east visable for only 2 minutes at best. bright light that faded out with a slight hint o
04/06/2002 20:15,6/4/2002,20:15,Ilford (UK/England),Ilford ,#N/A,,The Triangle shaped object was in the sky at a distance hovering in one place for quite some time with bright flashing lights of red gr
03/27/2002 19:50,27/3/2002,19:50,Nottingham (UK/England),Nottingham ,#N/A,,Single large cone shaped flying object with red and yellow flashing lights around the base.
03/24/2002 03:00,24/3/2002,03:00,Coventry (UK/England),Coventry ,#N/A,,Four round orange objects moving in an organised manner across the sky in two pairs. moving too rapidly for aircraft.
