11/06/2016 19:30,6/11/2016,19:30,Mortimer (UK/England),Mortimer ,#N/A,,White orb object illuminates over Berkshire!
10/17/2016 07:45,17/10/2016,07:45,Aylesbury (Buckinghamshire)(UK/England),Aylesbury ,#N/A,,White light moving slowly in the morning sky
09/28/2016 19:00,28/9/2016,19:00,Chesterfield,Chesterfield,Derbyshire,,"Two strange clouds swapping positions, with no visible illumination from the ground. Chesterfield UK. ((anonymous report))"
09/28/2016 05:45,28/9/2016,05:45,Shrewsbury (UK/England),Shrewsbury ,#N/A,,Two large triangle shaped craft shooting lasers to the ground above town.
09/21/2016 20:30,21/9/2016,20:30,Ellesmere (UK/England),Ellesmere ,#N/A,,3 bright lights fading in and out and moving quickly.
09/18/2016 23:20,18/9/2016,23:20,Worcester (UK/England),Worcester ,#N/A,,White lights darting above the clouds. ((anonymous report))
08/28/2016 09:30,28/8/2016,09:30,Northampton (UK/England),Northampton ,#N/A,,Bright red light craft disappeared into thin air.
08/19/2016 02:32,19/8/2016,02:32,Farnborough,Farnborough,Kent,,I saw 3 orbs in the sky that docked to the bottom of a large triangle ship
08/16/2016 07:12,16/8/2016,07:12,Manchester (UK/England),Manchester ,#N/A,,"I had just finished working a nightshift,when I was waiting at the bus stop. It was a clear morning and blue sky. I looked up at the sk"
08/13/2016 21:00,13/8/2016,21:00,Teston (UK/England),Teston ,#N/A,,Triangular object with white & blue lights.
08/12/2016 23:30,12/8/2016,23:30,Derby (UK/England),Derby ,#N/A,,4 lights not recorded on camera.
08/02/2016 00:45,2/8/2016,00:45,Alexandria (W. Dunbartonshire)(UK/Scotland),Alexandria ,#N/A,,Myself and my partner where out smoking when we both seen a light (the same size as a star but brighter) travelling at great speed (abo
07/18/2016 00:00,18/7/2016,00:00,London (England),London ,#N/A,,Watching air craft on the flight path to Heathrow Had polaroid glasses on. Coul see aircraft at high altitude .Below I would estimate f
07/09/2016 18:45,9/7/2016,18:45,Crawley (UK/England),Crawley ,#N/A,,Black cigar shaped object moving fast on slow mo
07/08/2016 20:33,8/7/2016,20:33,Peterborough (UK/England),Peterborough ,#N/A,,Diamond craft seen over Cambridgeshire in three separate occasions
07/07/2016 18:10,7/7/2016,18:10,Southampton,Southampton,Hampshire,,Plasma like orb close up
06/26/2016 02:00,26/6/2016,02:00,London (UK/England),London ,#N/A,,"Large rumbling noise followed by a high pitch ""twang"" and pulsating lights"
06/23/2016 22:00,23/6/2016,22:00,London (UK/England),London ,#N/A,,((HOAX??)) Big red ring flying across the sky. No noise. ((anonymous report))
06/04/2016 01:00,4/6/2016,01:00,London (UK/England),London ,#N/A,,Strange red lights.
05/24/2016 23:30,24/5/2016,23:30,Aylesbury (UK/England),Aylesbury ,#N/A,,"I was looking up at the night sky with my wife, as you do at the stars as I noticed a white light like a star, moving it was moving acr"
05/19/2016 01:06,19/5/2016,01:06,Bristol (UK/England),Bristol ,#N/A,,19/05/2016 U.F.O Spotted Today
05/16/2016 13:15,16/5/2016,13:15,Tenby (UK/Wales),Tenby ,#N/A,,Baffling!!
05/12/2016 08:45,12/5/2016,08:45,strood,strood,#N/A,,Object stationary in sky about 7000 feet up base was a deep red colour
05/01/2016 02:00,1/5/2016,02:00,Bognor Regis (UK/England),Bognor Regis ,#N/A,,"Line of three lights over Bognor Regis, UK."
04/28/2016 15:40,28/4/2016,15:40,Plymouth (UK/England),Plymouth ,#N/A,,"ISS feed, two circular craft coming from nowhere appeared on the live feed, hope someone was recording at this time 1540 GMT.. Objec"
03/31/2016 01:00,31/3/2016,01:00,Preston (UK/England),Preston ,#N/A,,Blinking light over England/UK.
03/26/2016 18:45,26/3/2016,18:45,Wigan (UK/England),Wigan ,#N/A,,I was sat on my couch with my son age 4 and a half when I saw the three separate orange orbs.
03/10/2016 19:30,10/3/2016,19:30,Ipswich (Suffolk; UK/England),Ipswich ,#N/A,,The object seem to move with glowing white not a plane moves faster been there for over a hour.
03/10/2016 06:30,10/3/2016,06:30,Manchester,Manchester,Greater Manchester,,Disc shaped craft seen hovering above road/buildings whilst in traffic. Amazing energy field surrounding craft.
03/07/2016 19:25,7/3/2016,19:25,Newark on Trent (UK/England),Newark on Trent ,#N/A,,I stepped outside to have a quick cigarette and as I looked skyward I saw a number of white lights pass over traveling north.
03/03/2016 22:30,3/3/2016,22:30,Gosport (to Fareham) (UK/England),Gosport  ,#N/A,,Saw a bright yellow/orange bright light at approx. 10.30pm. It was low in the sky and seemed to travel from Gosport to Fareham.
03/02/2016 19:39,2/3/2016,19:39,UK/England (offshore oil rig),UK/England ,#N/A,,Multiple triangular orange light formations over central North Sea.
02/29/2016 21:00,29/2/2016,21:00,London (Buckinghamshire)(UK/England),London ,#N/A,,"Black triangle, no noise, impossible mobility for its size, sighting lasted 45 minutes."
02/14/2016 00:30,14/2/2016,00:30,Hull (East Yorkshire) (UK/England),Hull  ,#N/A,,"Delta UFO type lights over Hull, UK."
02/07/2016 18:00,7/2/2016,18:00,Fortingall,Fortingall,#N/A,,Bright white light
01/01/2016 00:11,1/1/2016,00:11,London (UK/England),London ,#N/A,,https://www.youtube.com/watch?v=bmZ2bpJKXUI 11 minutes 8 seconds London Fireworks show… ((NUFORC Note: Pigeons? PD))
12/31/2015 19:00,31/12/2015,19:00,Southwest UK (UK/England),Southwest UK ,#N/A,,"Dull light moving slowly sometimes circling but turns out to be a big body like a cloud, but a moving thing. Lost time."
11/20/2015 01:00,20/11/2015,01:00,Attleborough,Attleborough,Norfolk,,"Orb was yellow with light orange tints, the size of a basket ball, it was swirling and looked like molton metal"
11/12/2015 20:05,12/11/2015,20:05,Derbyshire (UK/England),Derbyshire ,#N/A,,Bright light round speed.
11/11/2015 23:00,11/11/2015,23:00,Birmingham (UK/England),Birmingham ,#N/A,,"I was out in my garden around 23:00pm looking at the stars, it was a clear night and a very mild temperature for November. But then i n"
11/06/2015 19:30,6/11/2015,19:30,Eastville (Lincolnshire)(UK/England,Eastville (UK/England,#N/A,,Blue light 'spits-out' pink/red light.
10/31/2015 01:00,31/10/2015,01:00,classified,classified,#N/A,,((HOAX??)) I can't tell anyone.
10/21/2015 01:00,21/10/2015,01:00,London (UK/England),London ,#N/A,,Star-like UFO moving downwards in the sky and near by start disappearing.
10/20/2015 21:15,20/10/2015,21:15,Nuneaton (UK/England,Nuneaton (UK/England,#N/A,,Fast moving light changing direction and height.
10/19/2015 19:25,19/10/2015,19:25,Peterborough (Cambridgeshire) (UK/England),Peterborough  ,#N/A,,I just walked into my kitchen (East facing window) I immediately noticed 3 orange/reddish lights in the sky - travelling at a steady.
10/09/2015 00:00,9/10/2015,00:00,Stroud (UK/England),Stroud ,#N/A,,Massive spaceship appeared from nowhere in sky!?!.
10/01/2015 19:00,1/10/2015,19:00,Hull (East Yorkshire) (UK/England),Hull  ,#N/A,,"Three fast moving, erratic, red lights in the night sky."
09/30/2015 20:24,30/9/2015,20:24,Ebbw Vale (Blaenau Gwent) (UK/Wales),Ebbw Vale  ,#N/A,,Two adult witnesses observe two star-like objects in the nighttime sky.
09/30/2015 19:25,30/9/2015,19:25,Birmingham (UK/England),Birmingham ,#N/A,,I was on the way to work walkinguohurst lane north I saw an orange fire in the sky a bal of fire like a charriot then others followed i
09/29/2015 04:25,29/9/2015,04:25,Ampthill (UK/England),Ampthill ,#N/A,,I have seen this same ufo light nearly every morning for over 10 weeks. ((NUFORC Note: Venus? PD))
09/28/2015 04:52,28/9/2015,04:52,London (Ealing Broadway)(UK/England),London ,#N/A,,"Firstly... Hi Peter, I feel like I know you as I listen to you chatting to George Noory on C2C. First time I have a reason to communica"
09/23/2015 00:00,23/9/2015,00:00,Mansfield (UK/England),Mansfield ,#N/A,,100's of ufos!!!!! Different shapes sizes and colours.
09/20/2015 21:10,20/9/2015,21:10,Benson (UK/England),Benson ,#N/A,,"2 bright lights following each other North over Oxfordshire, England."
09/17/2015 15:33,17/9/2015,15:33,Bristol,Bristol,Somerset,,I took a series of photos of a rainbow with a mobile phone. Discovered on review.
08/22/2015 23:05,22/8/2015,23:05,Maidstone (UK/Enland),Maidstone ,#N/A,,"4 boomerang shaped craft fly in formation seemingly attached to one another, flying in impossible way."
08/17/2015 23:30,17/8/2015,23:30,Dorset (UK/England),Dorset ,#N/A,,((HOAX??)) Teardrop shaped. White light. Red pointy tail - UK
08/16/2015 23:19,16/8/2015,23:19,Bolton,Bolton,Greater Manchester,,We were away on holiday and our home surveillance camera caught a kind of fireball of white colour. Our security light came on for n
08/13/2015 00:40,13/8/2015,00:40,Scunthorpe (UK/England),Scunthorpe ,#N/A,,"Spherical object silently and rapidly transited the sky, stopped for a few seconds, then blinked out."
08/12/2015 21:25,12/8/2015,21:25,Birmigham (UK/England),Birmigham ,#N/A,,2 brown/red objects in the sky seemingly chasing one another.
08/12/2015 20:00,12/8/2015,20:00,Rosendale (UK/England),Rosendale ,#N/A,,Face to face with two beings but no UFO craft signing or anything.
08/11/2015 23:46,11/8/2015,23:46,Manchester (UK/England),Manchester ,#N/A,,Three red lights triangle craft.
08/11/2015 22:05,11/8/2015,22:05,Durham (UK/England),Durham ,#N/A,,Red light in sky moving closer
08/11/2015 20:30,11/8/2015,20:30,Minehead (Somerset)(UK/England),Minehead ,#N/A,,"Driving home after work along A39 near St Audries it was a clear night you could see the stars, there was a sudden flash of blue light"
08/11/2015 00:00,11/8/2015,00:00,Middlesbrough (UK/England),Middlesbrough ,#N/A,,Was calling my cat in clear sky could she all the stars a flying light was very fast could clearly see a white light flash flew across.
07/30/2015 21:50,30/7/2015,21:50,Worcestershire (UK/England),Worcestershire ,#N/A,,Witnessed two ufos and took photos.
07/29/2015 02:08,29/7/2015,02:08,Hinckley (UK/England),Hinckley ,#N/A,,A bright white circular object moving rapidly across the sky.
07/26/2015 00:05,26/7/2015,00:05,Redhill (UK/England),Redhill ,#N/A,,A luminous red sphere with red halo effect hanging still in black night sky; eighth the size of the moon.
07/25/2015 12:00,25/7/2015,12:00,Dumbarton,Dumbarton,Scotland,,My sighting was from inside the craft
07/23/2015 00:00,23/7/2015,00:00,Leicestershire (UK/England),Leicestershire ,#N/A,,Three anti-gravity triangles. ((NUFORC Note: We wonder whether this is a serious-minded report. PD))
07/19/2015 19:55,19/7/2015,19:55,Melton Mowbray (UK/England),Melton Mowbray ,#N/A,,Orange cloud hides object in sky.
07/19/2015 15:30,19/7/2015,15:30,Fife (UK/Scotland),Fife ,#N/A,,"Whilst at the local Knockhill Racing Circuit (Fife, Scotland) we noted a set of strange lights in the distance that appeared to be stat"
07/11/2015 11:45,11/7/2015,11:45,Grays (Essex)(UK/England),Grays ,#N/A,,"Strange orb with lights in the sky. ((NUFORC Note: Probably a lens flare, we suspect. PD))"
07/10/2015 01:30,10/7/2015,01:30,Market Rasen,Market Rasen,Lincolnshire,,Small orb humming and hovering above me and a friend in hammocks briefly before gliding off
07/09/2015 02:18,9/7/2015,02:18,Edgbaston (Birmingham)(UK/England),Edgbaston ,#N/A,,Dark black craft pouring hot heat trumpet noises no lights and around 30 foot long wide.
07/05/2015 23:30,5/7/2015,23:30,Birmingham (UK/England)k,Birmingham k,#N/A,,Red green white lights flashing very bright moving in formation two touched and seemed to bounce off each other hovering
07/01/2015 13:38,1/7/2015,13:38,Trimley St. Mary (UK/England),Trimley St. Mary ,#N/A,,Just sun bathing in my garden looked into the clouds and saw a oval shape moving through the clouds.
06/30/2015 22:30,30/6/2015,22:30,Saint Lawrence,Saint Lawrence,#N/A,,Shooting star that changed course
06/18/2015 22:00,18/6/2015,22:00,Exeter (UK/England),Exeter ,#N/A,,"These sightings were about two ago when I was back home visiting my family. Me, my brother, and his two friends were in our garden faci"
06/06/2015 22:57,6/6/2015,22:57,Bangor (UK/England),Bangor ,#N/A,,"Delta shaped craft going eastwards, could have been a Chinese satellite out of control/"
05/29/2015 23:00,29/5/2015,23:00,Chawton (village)(over farmland) (UK/England),Chawton  ,#N/A,,Object with/was a row of 4-5 round white or yellow and red lights moving slowly at very low altitude across night sky
05/16/2015 15:29,16/5/2015,15:29,Alton (town) (UK/England),Alton  ,#N/A,,large silver balloon/parachute shaped object decending from sky.
05/01/2015 00:00,1/5/2015,00:00,Warrington (Cheshire)(UK/England),Warrington ,#N/A,,Unusual noise...static feeling in the air; something going in and out of vision.
04/29/2015 00:00,29/4/2015,00:00,Barry (Vale of Glamorgan)(UK/Wales),Barry ,#N/A,,From what I have seen they are getting bigger.
04/15/2015 16:00,15/4/2015,16:00,Hemel Hempstead (UK/England),Hemel Hempstead ,#N/A,,"Looked round in shape black in colour hovering round in circles ,raised in to the atmosphere and dissapered"
04/12/2015 01:30,12/4/2015,01:30,Stansted (UK/England),Stansted ,#N/A,,"Red, orange and white lights on a triangular craft hovering over Stansted, England."
03/09/2015 19:00,9/3/2015,19:00,"Middlesbrough, Coulby Newham (UK/England)",Middlesbrough,Cleveland,,3 orange lights in triangle formation speeding up and slowing down.
03/05/2015 21:00,5/3/2015,21:00,Llangollen (UK/Wales),Llangollen ,#N/A,,Huge Chevron Craft Over Welsh Town in UK/Wales.
02/27/2015 10:25,27/2/2015,10:25,Gosport (UK/England),Gosport ,#N/A,,i was laying on my bed and saw a circle high in sky then four flashes as if in corners around circle but not attatched.then i thought i
02/22/2015 19:05,22/2/2015,19:05,Barrow-in-Furness (UK/England),Barrow-in-Furness ,#N/A,,"I saw a large light with 2 smaller lights either side, it didn't move then it vanished as I walked towards what i saw it reappeared i r"
02/18/2015 23:00,18/2/2015,23:00,Cannock (UK/England),Cannock ,#N/A,,Flying Egg over Morrisons Cannock!!
02/06/2015 19:00,6/2/2015,19:00,North Wales (UK/Wales),North Wales ,#N/A,,Saw a strange star in the Sky. Thought I might be looking at the space station! It tracked from right to left for about 2 minutes.
01/14/2015 17:30,14/1/2015,17:30,Mortimer (UK/England),Mortimer ,#N/A,,"Yellow bright orb object seen over Berkshire, England."
01/05/2015 22:00,5/1/2015,22:00,Derby (UK/England),Derby ,#N/A,,maybe answer to my encounter last year of black alien entity
01/04/2015 20:45,4/1/2015,20:45,Tyne & Wear (UK/England),Tyne & Wear ,#N/A,,We saw a strange light in the sky. I said to her straight away that doesn't look right. ((NUFORC Note: Twinkling star?? PD))
01/04/2015 02:05,4/1/2015,02:05,Gravesend (UK/England),Gravesend ,#N/A,,See something in sky and lost time.
12/28/2014 17:09,28/12/2014,17:09,UK/Scotland,UK/Scotland,#N/A,,"A star like light moves at high speed across the sky, with rotating colored lights."
12/25/2014 18:02,25/12/2014,18:02,Branksome,Branksome,#N/A,,"2 separate sighting detailed below, bright globe in the sky, larger than a star and moving so took video on my phone on both occasions"
12/25/2014 17:45,25/12/2014,17:45,Coatbridge (UK/Scotland),Coatbridge ,#N/A,,At first I looked towards the sky at what I initially thought was a helicopter. On closer inspection the object did not move.it was the
12/24/2014 17:30,24/12/2014,17:30,Keighley (UK/England),Keighley ,#N/A,,Please reply if other reports nr same time area PLEASE.
12/12/2014 06:30,12/12/2014,06:30,Isle of Man (UK/England),Isle of Man ,#N/A,,"Over the Isle of Man, very fast moving light, diving then zooming."
12/01/2014 06:50,1/12/2014,06:50,Hearthill (UK/Scotland),Hearthill ,#N/A,,Seen a light appearing then disappearing about 3x after disappearing for last time seen a light shooting across sky at super speed.
11/30/2014 22:00,30/11/2014,22:00,Studland,Studland,#N/A,,"Star up high moving around in night sky, went back and forth then would dart left to right but no uniform pattern."
11/25/2014 02:45,25/11/2014,02:45,Barnsley (UK/England),Barnsley ,#N/A,,4 different spherical lights of different colour. Rapidly moving.
11/23/2014 20:15,23/11/2014,20:15,Manchester (UK/England),Manchester ,#N/A,,Staring up at the stars. Saw a black triangle (with some lights on each corner) move silently across the night.
10/19/2014 13:00,19/10/2014,13:00,Coventry (UK/England),Coventry ,#N/A,,"Craft appeared in the middle of the day, moving very quickly and vanishing after about a minute"
10/16/2014 20:18,16/10/2014,20:18,Blackpool (UK/England),Blackpool ,#N/A,,"UFO sightings in the UK, Blackpool."
10/07/2014 18:39,7/10/2014,18:39,Oxford (UK/England),Oxford ,#N/A,,Five Lights in Clear Sky.
10/03/2014 20:00,3/10/2014,20:00,Swindon (UK/England),Swindon ,#N/A,,Triangular Craft seen at the Magic Roundabout Intersection
10/02/2014 21:00,2/10/2014,21:00,Nuneaton (Warwickshire)(UK/England),Nuneaton ,#N/A,,"Three red glows in a straight line side by side. At low level, to my eye no more than three hundred feet, no noise"
09/26/2014 20:00,26/9/2014,20:00,Oldham (UK/England),Oldham ,#N/A,,It was my nephews birthday and after the party myself and my sister and my daughter and my sisters partner were stood in a carpark and
09/14/2014 16:00,14/9/2014,16:00,Ludlow (UK/England),Ludlow ,#N/A,,Let me get this straight I do not really believe in the paranormal or UFOs for that matter. However what i saw i could not rule out it
09/13/2014 00:57,13/9/2014,00:57,Chester,Chester,Cheshire,,Glowing ball seen then second brighter glowing object with human like figure appearing from it. Darker mass then expanding
08/26/2014 23:00,26/8/2014,23:00,Peterborough (UK/England),Peterborough ,#N/A,,((HOAX??)) Formation 4 UFO's sighted in England.
08/12/2014 04:00,12/8/2014,04:00,Leigh on Sea (UK/England),Leigh on Sea ,#N/A,,"Stationary Lights in a triangle dimmed, then disappeared."
07/30/2014 03:24,30/7/2014,03:24,Fleetwood (UK/England),Fleetwood ,#N/A,,"Looked star shape till zoomed in , then it was changing shape and changing to a mulititude of different colors."
07/29/2014 11:15,29/7/2014,11:15,St. Albans (UK/England),St. Albans ,#N/A,,Three triangular craft with lights emitting from them tumbling in formation at high altitude and moving across sky in broad daylight.
07/22/2014 23:00,22/7/2014,23:00,The Longwood Estate (Hampshire)(UK/England),The Longwood Estate ,#N/A,,Largish bright white light/Object streaks across sky at Very low altitude in rural area.
07/15/2014 23:50,15/7/2014,23:50,Upper Rissington (UK/England),Upper Rissington ,#N/A,,I was outside having a smoke when I was looking at the stars I saw a round saucer like craft flashing red blue white lights.
07/11/2014 20:00,11/7/2014,20:00,Swansea (UK/Wales),Swansea ,#N/A,,"Bright star-like light in daylight, like Jupiter but much brighter. Viewed by me for 10 seconds. Not moving, faded into nothing."
07/01/2014 13:00,1/7/2014,13:00,London (UK/England),London ,#N/A,,Oval-shaped UFO - possible miniature flying drone near NATO HQ base.
06/19/2014 23:00,19/6/2014,23:00,Barnsley (UK/England),Barnsley ,#N/A,,Reddy/orange rectangle slow moving slow flashing light.
06/12/2014 23:00,12/6/2014,23:00,Derby (Derbyshire) (UK/England),Derby  ,#N/A,,"Vibrant white ball of light passes over Derby, UK. ((NUFORC Note: Possibly the ISS? PD))"
06/12/2014 00:00,12/6/2014,00:00,South Shields (UK/England),South Shields ,#N/A,,"Orange sphere, moving slowly then accelerating in speed."
06/07/2014 22:00,7/6/2014,22:00,Bradford (UK/England),Bradford ,#N/A,,Me and my partner was sitting in the back garden smoking a cig at 10 at night then out of nowere bright light apeared out of nowere lo
06/06/2014 01:50,6/6/2014,01:50,Peterborough (UK/England),Peterborough ,#N/A,,Light like a star in the sky wobble left to right.
06/01/2014 18:30,1/6/2014,18:30,London (UK/England),London ,#N/A,,"White object rotating in sky above London, England."
06/01/2014 00:00,1/6/2014,00:00,Brighton (UK/England),Brighton ,#N/A,,Darting circular lights in formation.
05/15/2014 22:30,15/5/2014,22:30,Mortimer Common (Berkshire) (UK/England),Mortimer Common  ,#N/A,,"Bright object over Berkshire, UK."
05/14/2014 20:25,14/5/2014,20:25,UK/England,UK/England,#N/A,,Orange egg shaped object photographed leaving the sun at sunset
05/12/2014 17:28,12/5/2014,17:28,Sherburn (in Elmet) (UK/England),Sherburn  ,#N/A,,"Short duration of view, never seen anything like it before, no sound, was silhouetted by the full Moon in the background."
05/07/2014 11:56,7/5/2014,11:56,Heswall (UK/England),Heswall ,#N/A,,((HOAX??)) Long triangle object moves with speed upwards.
05/05/2014 23:35,5/5/2014,23:35,St. Helens,St. Helens,#N/A,,"The object was bright red which seemed to turn bright white and then again back too a bright red it did so every second or so, it was m"
04/30/2014 18:30,30/4/2014,18:30,UK/Scotland,UK/Scotland,#N/A,,((HOAX?? Date is flawed.)) Perfectly-shaped clear white circle ring stationery in sky.
04/27/2014 01:00,27/4/2014,01:00,Durham (UK/England),Durham ,#N/A,,Red static light tri light poss moving slowly south. 10mile south of durham. Then two more hovering lower close to ground in heavy fog
04/19/2014 16:30,19/4/2014,16:30,Fife (UK/Scotland),Fife ,#N/A,,SILVER SPINNING OBJECT MOVING AT A FAST PACE.
04/19/2014 16:30,19/4/2014,16:30,Dunfermline (UK/Scotland),Dunfermline ,#N/A,,I was in my garden when a shiny metallic object caught my eye. The sky was blue and there were no clouds. The object seemed to be spinn
04/11/2014 04:40,11/4/2014,04:40,Newtongrange (Midlothian)(UK/Scotland),Newtongrange ,#N/A,,1 fast zipping light/red/green in distance & 1 whiteflash with r/green lights moving away appearing after flash & moving away from it.
04/09/2014 18:00,9/4/2014,18:00,Kent (UK/England),Kent ,#N/A,,"Two long poles set apart, shimmering in sunlight like silver, moving slowly - seen in daylight hours"
04/08/2014 22:50,8/4/2014,22:50,Weymouth (UK/England),Weymouth ,#N/A,,Brighter than the sun surfboard shape object traveling eastwards.
04/05/2014 20:10,5/4/2014,20:10,Sutton in Ashfield (UK/England),Sutton in Ashfield ,#N/A,,Buzzing object in sky.
04/01/2014 00:00,1/4/2014,00:00,Kempsey (Worcester) (UK/England),Kempsey  ,#N/A,,Green/red light seen moving downwards across the sky very fast . Looked like a flare coming down but way way too fast . No sound in the
03/24/2014 07:00,24/3/2014,07:00,Birmingham (UK/England),Birmingham ,#N/A,,"((HOAX??)) Yesterday, I saw a sphere or circle with red and flashing green light. I also heard a flapping sound coming from it."
03/24/2014 01:25,24/3/2014,01:25,London (UK/England),London ,#N/A,,2 WHITE AND GOLD LIGHTS OVER LONDON SPLIT THEN EMERGE INTO ONE.
03/20/2014 01:00,20/3/2014,01:00,Stoke-on-Trent (UK/England),Stoke-on-Trent ,#N/A,,"Bright blue orb seen flying low at an estimate of 500MPH travelling from the south, heading north between 1:00-1:30AM last night."
03/18/2014 20:00,18/3/2014,20:00,Lincoln (UK/England),Lincoln ,#N/A,,Light travelling horizontally then shooting upwards in a flash.
03/16/2014 20:30,16/3/2014,20:30,Cambridgeshire (UK/England),Cambridgeshire ,#N/A,,UFO witnessed on Space LIVE UK (C4).
03/12/2014 22:55,12/3/2014,22:55,Wembley,Wembley,Middlesex,,Steady Silent White Light Behind Cloud
03/08/2014 23:55,8/3/2014,23:55,Birmingham (UK/Birmingham),Birmingham ,#N/A,,"Two elongated triangle shaped craft, no noise or lights,one behind the other, Birmingham, England. March 8 2014."
03/05/2014 12:00,5/3/2014,12:00,Ipswich (UK/England),Ipswich ,#N/A,,Fast flying white object--did not disappear.
02/26/2014 18:30,26/2/2014,18:30,Macclesfield (Cheshire) (UK/England),Macclesfield  ,#N/A,,Klingon type ship over Macclesfield.
02/18/2014 18:45,18/2/2014,18:45,Torquay (UK/England),Torquay ,#N/A,,Star Shape White light no trails no colours no sound Smaller dimmer white giving chase.
02/16/2014 18:40,16/2/2014,18:40,Dorset (UK/England),Dorset ,#N/A,,Flying bright white light orb.
02/10/2014 21:30,10/2/2014,21:30,Christchurch (UK/England),Christchurch ,#N/A,,((HOAX??)) UFO's activity over two days caught on still image camera (not man made craft checked all databases).
02/02/2014 22:00,2/2/2014,22:00,Birmingham (UK/Endland),Birmingham ,#N/A,,Bright light flashing in bedroom no sine of any vehicle on the road looking out of my window and see a bright yellow almost golden flas
02/02/2014 07:02,2/2/2014,07:02,Rothwell (UK/England),Rothwell ,#N/A,,"OK this may sound strange, but about 10 mins or so ago, i spotted an object in the sky quite bright flying past my bedroom. at 1at i th"
01/20/2014 20:46,20/1/2014,20:46,A55 Northope (UK/North Wales),A55 Northope ,#N/A,,"Red, green and white lights seen on craft over A55 road in North Wales."
01/12/2014 18:00,12/1/2014,18:00,Burton on Trent (Staffordshire) (UK/England),Burton on Trent  ,#N/A,,Red/green lights moving at various speeds.
01/10/2014 16:30,10/1/2014,16:30,Pendle (UK/England),Pendle ,#N/A,,A light hovered down the hill at a ridiculous speed.
01/04/2014 18:20,4/1/2014,18:20,Coventry (UK/England),Coventry ,#N/A,,Amazing.
01/02/2014 05:20,2/1/2014,05:20,Holywell (UK/Wales),Holywell ,#N/A,,Bright white flash over Holywell GB.
12/28/2013 18:40,28/12/2013,18:40,Harrogate (UK/England),Harrogate ,#N/A,,Small triangular formation of lights performs flight display then vanishes over playing field.
12/26/2013 01:00,26/12/2013,01:00,Hampshire (UK/England),Hampshire ,#N/A,,((HOAX??)) Boomerang shaped ufo seen in Southampton (UK).
12/24/2013 02:30,24/12/2013,02:30,Dartmouth (UK/England),Dartmouth ,#N/A,,Clear flash following by comet or shooting star.
12/14/2013 23:30,14/12/2013,23:30,Stirling (UK/Scotland),Stirling ,#N/A,,"I have just seen about a half an hour ago a blue imminating flash upon the sky 3 times tonight, the first time was at about 12:00 at ni"
12/10/2013 02:55,10/12/2013,02:55,Bristol (UK/England),Bristol ,#N/A,,UFO sighting in bristol bright lights hovering still and cricling the sky before landing.
