12/25/2008 04:45,25/12/2008,04:45,Bury st Edmunds,Bury st Edmunds,Suffolk,,"three, craft, silent,"
12/25/2008 00:30,25/12/2008,00:30,Earl Shilton (UK/England),Earl Shilton ,#N/A,,Brilliant light in sky with smaller light separating and descending to the ground.
12/24/2008 20:00,24/12/2008,20:00,Uddingston (UK/Scotland),Uddingston ,#N/A,,"6 bright orange lights moving silently in the sky over Lanarkshire, Scotland"
12/24/2008 16:16,24/12/2008,16:16,"Ely, Cambridge (UK/England)",Ely,Cambridgeshire,,"UFOs photographed Xmas Eve near Ely Carthedral, Cambridge, England"
12/23/2008 21:20,23/12/2008,21:20,North Shields (UK/England),North Shields ,#N/A,,This seemed to be a rendezvous between the huge further away object and the smaller brilliant round flat object that flew over my head.
12/23/2008 17:11,23/12/2008,17:11,Harwich (UK/England),Harwich ,#N/A,,fireballs hover over road and disappear
12/22/2008 18:07,22/12/2008,18:07,Mablethorpe (UK/England),Mablethorpe ,#N/A,,"two orange lights seen over mablethorpe coast, north end, and orb over huttoft coast,"
12/20/2008 23:30,20/12/2008,23:30,Haywards Heath (UK/England),Haywards Heath ,#N/A,,"UFO Sighting I was driving north-eastwards towards Lindfield (UK) on the B2028 at about 2330 UTC on 20th December 2008, when I noticed"
12/17/2008 16:40,17/12/2008,16:40,Lowestoft (UK/England),Lowestoft ,#N/A,,"bright light, then went small, moved across the sky very quickly, dissapeared then small flashes in the sky where it was. 500 Light"
12/15/2008 18:09,15/12/2008,18:09,Derby (UK/England),Derby ,#N/A,,Two Bright lights move slowly over Derby before being joined by a third to form a triangle.
12/12/2008 21:29,12/12/2008,21:29,Manchester (UK/England),Manchester ,#N/A,,((HOAX??)) orange mesh spheres descend on M14 6QA
12/10/2008 02:00,10/12/2008,02:00,Leicester (UK/England),Leicester ,#N/A,,it moved across the sky with small flashing lights on it and it was very quick and it dissapearred into a cloud.
12/07/2008 19:45,7/12/2008,19:45,Runcorn (UK/England),Runcorn ,#N/A,,5 burning slow moving objects phtographed in england
12/04/2008 12:00,4/12/2008,12:00,Milton (near Banbury) (UK/England),Milton  ,#N/A,,bright slow moving non formation circular objects over north oxfordshire
12/01/2008 21:21,1/12/2008,21:21,Clee Hill (UK/England),Clee Hill ,#N/A,,Object burning up or glancing off atmoshere sets a flame trail in sky.
12/01/2008 04:05,1/12/2008,04:05,Birkenhead (UK/England),Birkenhead ,#N/A,,Dull orange glowing diamon shaped craft flying extremelly high at rapid velocity.
11/27/2008 00:00,27/11/2008,00:00,Bedfordshire (UK/England),Bedfordshire ,#N/A,,"Medium lit, square shaped white lights in a saucer shape, spinning around in night sky. Huge, no sound but the bathroom light went out"
11/23/2008 19:50,23/11/2008,19:50,Staffordshire (UK/England),Staffordshire ,#N/A,,"Ball of fire moving acroos the sky, roughly the same speed you would expect a plane to move at."
11/23/2008 01:13,23/11/2008,01:13,Thornton-Cleveleys (UK/England),Thornton-Cleveleys ,#N/A,,YOU MUST READ THIS!!!!!!! This could not of been 5 planes they were far too close to each other........
11/22/2008 19:05,22/11/2008,19:05,Scottish Borders (UK/Scotland),Scottish Borders ,#N/A,,three orange lights over the Scottish Borders
11/22/2008 19:04,22/11/2008,19:04,Oxford (UK/England),Oxford ,#N/A,,Orange ball over south Oxford with ring of orange lights normal speed
11/22/2008 19:00,22/11/2008,19:00,Peacehaven (UK/England),Peacehaven ,#N/A,,lights in sky in peacehaven
11/21/2008 00:00,21/11/2008,00:00,"Leeds, England (UK/England)",Leeds,West Yorkshire,,2 circular white lights in the sky.
11/20/2008 20:10,20/11/2008,20:10,Rochester (Kent) (UK/England),Rochester  ,#N/A,,2 ufo's over Rochester (UK) with vid
11/19/2008 17:45,19/11/2008,17:45,Murton (UK/England),Murton ,#N/A,,Ufo seen on A19 road in uk near murton
11/18/2008 21:05,18/11/2008,21:05,"Brixworth, Northampton (UK/England)",Brixworth,#N/A,,"Two Black Triangle shaped craft, moving slowly together"
11/14/2008 22:00,14/11/2008,22:00,Birmingham (UK/England),Birmingham ,#N/A,,"Was a circular shape with the lights goin acorss the centre of it flying over Birmingham, England"
11/14/2008 21:00,14/11/2008,21:00,Manchester (Glossup) UK/England,Manchester  UK/England,#N/A,,8 round red stationary objects that shone even through the clouds.
11/14/2008 20:00,14/11/2008,20:00,Lincoln (UK/England),Lincoln ,#N/A,,Brief view of fast object
11/14/2008 18:23,14/11/2008,18:23,Warwickshire (UK/England),Warwickshire ,#N/A,,"bright, blurry light fairly low in the sky with absolutely no sound, moving quite quickly in a straight line."
11/14/2008 17:00,14/11/2008,17:00,"Boston, Lincolnshire (UK/England)",Boston,Lincolnshire,,"UFO sighted over boston, lincolshire 14th november 2008, semi circular with triangle orange light at 'rear'."
11/13/2008 19:20,13/11/2008,19:20,"Dover, Kent (UK/England)",Dover,Kent,,I never thought that I would be in a position whereby I would call the police to report objects in the sky that I could not identify.
11/12/2008 20:20,12/11/2008,20:20,"St Helens, Merseyside (UK/England)",St Helens,Merseyside,,bright orange light
11/10/2008 19:05,10/11/2008,19:05,"Handforth, Wilmslow, Cheshire (UK/England)",Handforth,#N/A,,Orange fireball over North East Cheshire moving South to North
11/09/2008 23:15,9/11/2008,23:15,Rugeley (UK/England),Rugeley ,#N/A,,bright blue light bright enought to light at least a mile square up
11/07/2008 21:00,7/11/2008,21:00,Abercarn (UK/Wales),Abercarn ,#N/A,,"3 Red lit objects over Abercarn, Gwent UK.."
11/02/2008 09:15,2/11/2008,09:15,London (UK/England),London ,#N/A,,"Unknown , roughly shaped object spotted over North London"
11/01/2008 21:20,1/11/2008,21:20,Glenrothes (UK/Scotland),Glenrothes ,#N/A,,"UFO IN SCOTLAND, UK"
10/31/2008 21:50,31/10/2008,21:50,Hereford (UK/England),Hereford ,#N/A,,"5 orange objects over eastern horizon, viewed from SE Hereford in the UK"
10/31/2008 09:25,31/10/2008,09:25,London (UK/England),London ,#N/A,,The object was slowly moving across the Heathrow fight path over Richmond in Surrey. It was a dark object but it was also changing sha
10/30/2008 19:40,30/10/2008,19:40,Aberdeen (UK/Scotland),Aberdeen ,#N/A,,3 stationary orange lights above city of Aberdeen
10/24/2008 00:00,24/10/2008,00:00,Salford (Manchester) (UK/England),Salford  ,#N/A,,Something weird in the sky. ((NUFORC Note: Water droplet on lens of camera. PD))
10/22/2008 19:25,22/10/2008,19:25,Kirkby in Ashfield (UK/England),Kirkby in Ashfield ,#N/A,,orange ball seen over kirkby in ashfield nottinghamshire england
10/17/2008 22:00,17/10/2008,22:00,Bracknell (UK/England),Bracknell ,#N/A,,blue/white light moving away quickly
10/15/2008 00:00,15/10/2008,00:00,Hull (UK/England),Hull ,#N/A,,2 orangey red discs similar to other reports from the time.
10/12/2008 21:30,12/10/2008,21:30,Buckinghamshire (UK/England),Buckinghamshire ,#N/A,,i saw a ufo
10/12/2008 21:00,12/10/2008,21:00,Stafford (UK/England),Stafford ,#N/A,,"Another UFO, definately watching me and sending signals."
10/07/2008 19:15,7/10/2008,19:15,Sheffield (UK/England),Sheffield ,#N/A,,"a small flat disked shape, orange coloured, with orange rays coming off, moved further in the sky at late evening."
10/05/2008 18:24,5/10/2008,18:24,Aberdeen (UK/Scotland),Aberdeen ,#N/A,,Bright orange round light moving over city
10/03/2008 10:30,3/10/2008,10:30,"Chawton, Hampshire (UK/England)",Chawton,#N/A,,Circular bright orange light in the night sky that glowed twice (on/off) before disappearing
10/02/2008 20:00,2/10/2008,20:00,Neacroft (Christchurch) Bournemouth (UK/England),Neacroft  Bournemouth ,#N/A,,Cluster of flashing lights spotted
09/29/2008 21:45,29/9/2008,21:45,Barnsley (UK/England),Barnsley ,#N/A,,A BIG GREEN ORB JUST ABOVE TREES FOLLOWED MY FATHER ACOSS A FIELD IT ALSO HAD SMALLER GREEN LIGHTS GOING IN A CIRCULAR SHAPE AROUND IT.
09/28/2008 20:59,28/9/2008,20:59,Selborne (Hampshire) (UK/England),Selborne  ,#N/A,,Pulsating orange light or lights(or Orbs) that moved up and down in the sky before Disappearing
09/28/2008 19:32,28/9/2008,19:32,Bournemouth (UK/England),Bournemouth ,#N/A,,"A super bright light, constant, in a straight line, no noise or flashing!!"
09/27/2008 19:00,27/9/2008,19:00,"Morden, Surrey (UK/England)",Morden,Surrey,,"Strange object over the skies of Morden, Surrey, UK"
09/26/2008 21:30,26/9/2008,21:30,"Morde, Surrey (UK/England)",Morde,#N/A,,Morden sighting 26/09/08
09/26/2008 20:15,26/9/2008,20:15,Leeds (UK/England),Leeds ,#N/A,,"Slow moving light over Leeds, West Yorkshire"
09/26/2008 20:10,26/9/2008,20:10,UK/Wales,UK/Wales,#N/A,,this was a ufo
09/25/2008 22:01,25/9/2008,22:01,Newport (UK/Wales),Newport ,#N/A,,orange light in night sky
09/25/2008 20:55,25/9/2008,20:55,Shrewsbury (UK/England),Shrewsbury ,#N/A,,"Orange light moving fast across the sky, no sound."
09/25/2008 16:15,25/9/2008,16:15,London (UK/England),London ,#N/A,,"small, fast moving sphere travelling in straight line high up on a cloudy day in London"
09/22/2008 20:46,22/9/2008,20:46,Edinburgh (UK/Scotland),Edinburgh ,#N/A,,"Clear sky, near cassiopeia-triangle shaped with 3rd object in parallel. Perfect formation & very fast & high in sky."
09/21/2008 20:00,21/9/2008,20:00,Cardiff (UK/Wales),Cardiff ,#N/A,,seemed like stars travelling as if they were planes
09/21/2008 16:00,21/9/2008,16:00,Featherstone (UK/England),Featherstone ,#N/A,,Bright Flashing Light over Featherstone UK approximately 20 times before leaving M54
09/21/2008 13:30,21/9/2008,13:30,Wakefield (UK/England),Wakefield ,#N/A,,Bright white light in sky emerges as 2/3 segmented object.
09/20/2008 21:00,20/9/2008,21:00,"Wadebridge, Cornwall (UK/England)",Wadebridge,Cornwall,,"North Cornwall, UK, circular craft, with pulsating lights surrounding it: blue, yellow, red."
09/20/2008 20:35,20/9/2008,20:35,Timperley (UK/England),Timperley ,#N/A,,Vanishing evening star
09/19/2008 19:50,19/9/2008,19:50,Stoke-on-Trent (UK/England),Stoke-on-Trent ,#N/A,,Orange ball shape light spotted over Stoke on Trent 19 Sept 2008
09/18/2008 21:55,18/9/2008,21:55,Crudwell (UK/England),Crudwell ,#N/A,,"Red/orange lights moving slowly in the dark night sky, with no sound."
09/18/2008 21:30,18/9/2008,21:30,Weymouth (UK/England),Weymouth ,#N/A,,Black triangle with dim white lights in its corners flying overhead
09/12/2008 20:45,12/9/2008,20:45,UK/England,UK/England,#N/A,,"80-100 rectangle shaped lights spinning together clockwise, a huge see-through mixing bowl shape ufo."
09/11/2008 21:15,11/9/2008,21:15,Manchester (UK/England,Manchester (UK/England,#N/A,,"5 yellow lights travelling in a line about a mile apart that made no noise and nothing but the light was visible, Manchester UK"
08/24/2008 00:00,24/8/2008,00:00,Rhos (near Wrexham) (UK/England),Rhos  ,#N/A,,"three orange lights regularly appeared formed triangle and headed off into north wales mountians ,nr wrexham"
08/23/2008 01:27,23/8/2008,01:27,Cambridgeshire (UK/England),Cambridgeshire ,#N/A,,"Many bright orange circluar objects/lights, hovering slowly to the east up and down in a random motion."
08/19/2008 21:51,19/8/2008,21:51,Colwynbay (UK/England),Colwynbay ,#N/A,,I WAS GOING HOME AND NOTICED AN ORANGE LIGHT IN THE SKY TRAVELING TOWARDS ME THERE WAS NO SOUND AS IT PASSED OVERHEAD. I GRABBED MY
08/16/2008 21:47,16/8/2008,21:47,London East (UK/England),London East ,#N/A,,((HOAX??)) Some unidentifyed phenomenon in the skyes of East london.
08/14/2008 19:30,14/8/2008,19:30,Rotherham (UK/England),Rotherham ,#N/A,,large red area seen in sky in Rotherham England
08/12/2008 10:00,12/8/2008,10:00,Conwy (UK/Wales),Conwy ,#N/A,,Orange Light In the sky
08/10/2008 23:55,10/8/2008,23:55,Birmingham (UK/England),Birmingham ,#N/A,,"BRIGHT LIGHT TRAVELLING FAST,TURNING QUICKLY TO RETURN THE WAY IT HAD COME FROM."
08/09/2008 02:00,9/8/2008,02:00,Alton (Hampshire) (UK/England),Alton  ,#N/A,,Strange Bright white light hovering over nearby wood.
08/07/2008 22:00,7/8/2008,22:00,Grangemouth (UK/Scotland),Grangemouth ,#N/A,,very bright lights in the sky that mooved then went straight up into the clouds
08/04/2008 23:00,4/8/2008,23:00,Ingoldmells (UK/England),Ingoldmells ,#N/A,,"Ingoldmells, object which appeared cloaked moved quickly with a whirring sound, also 3 separate lights disappearing above the sea"
08/03/2008 22:00,3/8/2008,22:00,North Yorkshire (UK/England),North Yorkshire ,#N/A,,two oval objects !
08/01/2008 20:30,1/8/2008,20:30,Brighton (UK/England),Brighton ,#N/A,,"((HOAX??)) 2 objects, 1 was a helicopter observing glowing object which moved erratically, then helicopter gave chase."
07/30/2008 21:55,30/7/2008,21:55,North London (UK/England),North London ,#N/A,,ORANGE LIGHT MOVING ERRATICALLY BEFORE MOVING QUICKLY UPWARDS DURATION APROC 3 MINS
07/29/2008 22:00,29/7/2008,22:00,Telford (UK/England),Telford ,#N/A,,"A light that moved strangely at the same speed and height, then desended downwards and disappeared"
07/27/2008 22:20,27/7/2008,22:20,Warrington (UK/England),Warrington ,#N/A,,Dumbell-shaped object with bright light and roaring noise.
07/27/2008 14:15,27/7/2008,14:15,Brean (Sommerset) (UK/England),Brean  ,#N/A,,"cigar shaped object or rod shaped u.f.o spotted over brean, sommerset, united kingdom"
07/26/2008 23:00,26/7/2008,23:00,Bristol (UK/England),Bristol ,#N/A,,"2 red spheres sighted, in the Western sky, moving slowly, then gradually faded out, one after the other as if leaving orbit ."
07/26/2008 22:00,26/7/2008,22:00,Norton (UK/England),Norton ,#N/A,,Strange anomalies on photo's such as colourful balls that can't be seen with the naked eye
07/24/2008 22:20,24/7/2008,22:20,Burton-on-Trent (UK/England),Burton-on-Trent ,#N/A,,silent star-like ufo sighted in uk
07/24/2008 00:00,24/7/2008,00:00,Gwent (UK/Wales),Gwent ,#N/A,,they looked like to white football flying side by side. they were only in view for around 30 seconds.
07/21/2008 22:35,21/7/2008,22:35,Portsmouth (UK/England),Portsmouth ,#N/A,,equilateral triangle shape red and white flashing lights
07/20/2008 00:15,20/7/2008,00:15,London (UK/England),London ,#N/A,,Three orange glowing lights slowly moving across the sky.
07/16/2008 20:49,16/7/2008,20:49,Doncaster,Doncaster,South Yorkshire,,3 objects hovering over housing estate.
07/15/2008 22:15,15/7/2008,22:15,County Durham (UK/England),County Durham ,#N/A,,possible sighting in co durham
07/14/2008 22:00,14/7/2008,22:00,Potters Bar (UK/England),Potters Bar ,#N/A,,Three bright orange oval ojects sighted in the sky travelling East
07/14/2008 01:00,14/7/2008,01:00,Brighton (UK/England),Brighton ,#N/A,,Large & Tiny Morphing Objects as seen in the same area as many other UFO's
07/12/2008 22:21,12/7/2008,22:21,Dover (UK/England),Dover ,#N/A,,Orange objects flying over Dover Kent England July 12th 2008
07/12/2008 02:00,12/7/2008,02:00,Marlow (UK/England),Marlow ,#N/A,,"six seperate objects moving silently above marlow in bucks, uk"
07/12/2008 00:00,12/7/2008,00:00,UK/England,UK/England,#N/A,,UFO going through the sky
07/11/2008 18:30,11/7/2008,18:30,Manchester (Salford) (UK/England),Manchester  ,#N/A,,I just opened my front door to go for a cigerette and a bright light (like a planes front light from a distance or a very bright star
07/11/2008 14:09,11/7/2008,14:09,Cardiff (UK/Wales),Cardiff ,#N/A,,"UFO Wales, Barry, Friday 11th July 2008"
07/07/2008 23:08,7/7/2008,23:08,Huddersfield (UK/England),Huddersfield ,#N/A,,Multi lighted saucer shape doing zigzag flights over English deserted moor
07/06/2008 22:00,6/7/2008,22:00,Northhampton (UK/England),Northhampton ,#N/A,,orange lights in my field moving in random direcions
07/05/2008 01:30,5/7/2008,01:30,London (UK/England),London ,#N/A,,STRANGE LIGHT
07/04/2008 23:00,4/7/2008,23:00,Kettering (UK/England),Kettering ,#N/A,,a cigar shape light moving slow to the left then shot of with speed to the right
07/04/2008 00:05,4/7/2008,00:05,Shirebrook (UK/England),Shirebrook ,#N/A,,4 dark disc shaped objects with green lights round the edge
07/03/2008 19:30,3/7/2008,19:30,Rorherham (UK/England uk),Rorherham ,#N/A,,2 grey circles moving fast
07/02/2008 23:00,2/7/2008,23:00,London (UK/England),London ,#N/A,,"triangle cruising steady,with no light just a light red glow on the under belly. ((NUFORC Note: ISS??))"
06/29/2008 22:45,29/6/2008,22:45,Cheltenham (UK/England),Cheltenham ,#N/A,,Orange lights/fireballs
06/29/2008 02:30,29/6/2008,02:30,Thetford (UK/England),Thetford ,#N/A,,One large and 3 to 4 smaller lights all white and round. Smaller lights moved around big light.
06/25/2008 23:15,25/6/2008,23:15,Lakenheath (UK/England),Lakenheath ,#N/A,,stared as 2 became 3 one moved off from the other 2
06/25/2008 22:30,25/6/2008,22:30,Hull (UK/England),Hull ,#N/A,,"UFO over Hull, UK"
06/25/2008 22:00,25/6/2008,22:00,Sheffield (UK/England),Sheffield ,#N/A,,"5 lights, Diamond formation above street. UK 2008."
06/25/2008 22:00,25/6/2008,22:00,Market Drayton (UK/England),Market Drayton ,#N/A,,Soldier told last night how he saw UFOs spinning in the skies above his military barracks
06/25/2008 20:50,25/6/2008,20:50,"Chawton, Hampshire (UK/England)",Chawton,#N/A,,Small moving white object flying at high altitude before disappearing.
06/24/2008 22:00,24/6/2008,22:00,Surrey (UK/England),Surrey ,#N/A,,big orange ufo
06/24/2008 05:50,24/6/2008,05:50,Leeds (UK/England),Leeds ,#N/A,,Silver Orb above Leeds UK
06/22/2008 01:00,22/6/2008,01:00,Colchester (UK/England),Colchester ,#N/A,,Bright orange orbe over Colchester England
06/21/2008 00:45,21/6/2008,00:45,Burnley (UK/England),Burnley ,#N/A,,((HOAX)) bright light hovering in sky which expanded then vanished.
06/20/2008 23:00,20/6/2008,23:00,Oldham (Manchester)(UK/England),Oldham ,#N/A,,"Two Birght orange lights hovering over the penines in Odham, England"
06/17/2008 16:40,17/6/2008,16:40,"Chawton, Hampshire (UK/England)",Chawton,#N/A,,unknown white object appears flying at low altitude then suddenly seems to dissappear.
06/16/2008 19:45,16/6/2008,19:45,Swindon/Didcott (UK/England),Swindon/Didcott ,#N/A,,"Bright, static, object with tail - helicopter in possibly pursuit"
06/15/2008 19:00,15/6/2008,19:00,London (UK/England),London ,#N/A,,Matalic blue object over central London.
06/14/2008 02:00,14/6/2008,02:00,Southampton (UK/England),Southampton ,#N/A,,triangle shap in night sky
06/12/2008 01:00,12/6/2008,01:00,Bristol (UK/England),Bristol ,#N/A,,large figure stoof in my doorway and flashes of light. ((NUFORC Note: May not be a serious report?? PD))
06/09/2008 21:00,9/6/2008,21:00,"Sherston, Malmesbury (UK/England)",Sherston,#N/A,,Torpedo shaped object crosses sky noiselessly
06/08/2008 22:30,8/6/2008,22:30,Gloucester (UK/England,Gloucester (UK/England,#N/A,,on object of multi rings of white balls of light moving across the sky and flashing
06/08/2008 21:40,8/6/2008,21:40,Havant (UK/England),Havant ,#N/A,,"UK UFO OVER HAVANT, HAMPSHIRE JUNE 8th 2008 REORTED BY G. ARMSTRONG"
06/08/2008 00:15,8/6/2008,00:15,Falmouth (UK/England),Falmouth ,#N/A,,Bright flash in eastern sky
06/08/2008 00:00,8/6/2008,00:00,Cardiff (UK/Wales),Cardiff ,#N/A,,http://www.thesun.co.uk/sol/homepage/news/article1315843.ece
06/07/2008 23:00,7/6/2008,23:00,Hereford (UK/England),Hereford ,#N/A,,"lights,no sound overhead,hereford u.k."
05/31/2008 22:25,31/5/2008,22:25,Sheffield (UK/England),Sheffield ,#N/A,,Two orbs travelling parallel and disappearing
05/31/2008 22:00,31/5/2008,22:00,Guernsey (UK/England),Guernsey ,#N/A,,bright lights moving very fast
05/30/2008 23:37,30/5/2008,23:37,Devon (UK/England),Devon ,#N/A,,bright object moving at speed then dissapear it was a clear night with stars
05/24/2008 00:20,24/5/2008,00:20,"Alton, Hampshire (UK/England)",Alton,Hampshire,,strange slow moving white light which had no lights on it and made no sound moving overhead and out of sight
05/13/2008 03:40,13/5/2008,03:40,Essex (UK/England),Essex ,#N/A,,"Bright white flashing light, emitting sparks, making a slow incline over Essex coast in England."
05/10/2008 23:00,10/5/2008,23:00,UK/Scotland,UK/Scotland,#N/A,,bright fast moving light
05/09/2008 23:20,9/5/2008,23:20,Marlow (UK/England),Marlow ,#N/A,,9 large star like objects in a perfect line about a mile across.
05/09/2008 22:33,9/5/2008,22:33,Cannock (UK/England),Cannock ,#N/A,,"Flashes in the sky, inside fake clouds. Silhouetted Oval, Computer died when camera was activated for recording."
05/04/2008 21:35,4/5/2008,21:35,Edinburgh (UK/Scotland),Edinburgh ,#N/A,,4/5 looked like dark objects but were 50% bright orange lights in the front
04/26/2008 21:20,26/4/2008,21:20,Torquay (UK/England),Torquay ,#N/A,,"Photographed object and soundless white/red lights over Torquay, red light shining spotlight and spiralling whte lighte at Preston"
04/21/2008 16:10,21/4/2008,16:10,Nunburnholme (UK/England),Nunburnholme ,#N/A,,"it was just after school when an extremely large UFO hovered above nunburnholme hill, it made no noise but made huge beames of light!"
04/13/2008 21:27,13/4/2008,21:27,"Fair Oak, Hampshire (UK/England)",Fair Oak,#N/A,,"Triangle formation observed at Fair Oak, Hampshire, England"
04/12/2008 23:35,12/4/2008,23:35,Chesterfield (UK/England),Chesterfield ,#N/A,,"Orangel glowing light floating over Chesterfield, Derbyshire UK then fading away"
04/12/2008 22:00,12/4/2008,22:00,Seaton (UK/England),Seaton ,#N/A,,Series of 13 orange lights travelling silently from West to East on same trajectory but not evenly spaced.
04/12/2008 21:00,12/4/2008,21:00,Stafford (UK/England),Stafford ,#N/A,,"3 UFO's spotted in the same spot as another before months ago, apparently watching me. ((NUFORC Note: Possible hoax?? PD))"
04/09/2008 03:00,9/4/2008,03:00,Haworth (UK/England),Haworth ,#N/A,,"One dim white light followed by a much brighter silvery 'ball' of light, moving at first slowly, almost directly above and in parallel."
04/08/2008 03:00,8/4/2008,03:00,Wrexham (UK/England),Wrexham ,#N/A,,Orange globe over Wales UK.
04/07/2008 22:30,7/4/2008,22:30,Derbyshire (UK/England),Derbyshire ,#N/A,,Bright red and orange glowing circle moving fast and then hovering for a few seconds then it and moved away
04/06/2008 00:56,6/4/2008,00:56,Worksop (UK/England),Worksop ,#N/A,,"Undetermined shape, with wings and fin, with continuous row of lights round the side and back, with red green and orange lights"
03/30/2008 20:48,30/3/2008,20:48,UK/England,UK/England,#N/A,,"2 bright lights moving in perfect sync, one stopped the other continued west at very high speed."
03/27/2008 08:00,27/3/2008,08:00,London (UK/England),London ,#N/A,,"London Terminal 5 opening breakfast news, sighting of a man in a white space suit, captured on BBC film!"
03/19/2008 20:40,19/3/2008,20:40,South Wales (UK/S.Wales),South Wales ,#N/A,,It was glowing a irridescent light green and a luminouse blue.
03/14/2008 17:30,14/3/2008,17:30,Halifax (UK/England),Halifax ,#N/A,,"Two lights moving in the sky, viewed in the sky (looking south) from village of Shelf in Halifax, England. They are both like oval sha"
03/04/2008 18:00,4/3/2008,18:00,Durham (UK/England),Durham ,#N/A,,Cone shape over Durham
02/19/2008 17:30,19/2/2008,17:30,"Chawton, Hampshire (UK/England)",Chawton,#N/A,,Moving white light that glowed/shined and then completely vanished.
02/17/2008 17:00,17/2/2008,17:00,Wigan (UK/England),Wigan ,#N/A,,"strange shape seen over wigan, lancashire"
02/16/2008 19:00,16/2/2008,19:00,Kendal (UK/England),Kendal ,#N/A,,((HOAX??)) was a light in the sky that justed warped into space after 20 secs
02/15/2008 19:03,15/2/2008,19:03,UK/England,UK/England,#N/A,,egg shaped object big red flashing light
02/12/2008 21:25,12/2/2008,21:25,Dalkieth (Edinborough (UK/Scotland),Dalkieth ,#N/A,,asteroid from bedroom window through a skywatcher 4 in scope
02/12/2008 11:20,12/2/2008,11:20,Luton (UK/England),Luton ,#N/A,,small bright star like object hovering in the sky
02/11/2008 18:30,11/2/2008,18:30,Wolverhampton (UK/England),Wolverhampton ,#N/A,,"4 red lights, rectangle, flying slowly west to east over Wolverhampton"
02/10/2008 14:50,10/2/2008,14:50,East Barnet (UK/England),East Barnet ,#N/A,,3 round dancing silver balls near plane..uk
02/10/2008 12:35,10/2/2008,12:35,London (UK/England),London ,#N/A,,Silver bright obect over Heathrow
02/10/2008 02:00,10/2/2008,02:00,Maidenhead (UK/England),Maidenhead ,#N/A,,((HOAX??)) Synchronized red lights
02/08/2008 21:00,8/2/2008,21:00,Wakefield (UK/England),Wakefield ,#N/A,,"White light over Wakefield, West Yorkshire, United Kingdom"
02/07/2008 08:00,7/2/2008,08:00,Bolton (UK/England),Bolton ,#N/A,,Rugby shape window area in sky with a craft inside.
02/06/2008 23:40,6/2/2008,23:40,Durham (UK/England),Durham ,#N/A,,Three Orange lights
02/03/2008 13:30,3/2/2008,13:30,Holywell (UK/Wales),Holywell ,#N/A,,very bright daylight sighting with video and photo
02/02/2008 14:40,2/2/2008,14:40,London (UK/England),London ,#N/A,,Black diamond shaped UFO over north london
01/30/2008 20:35,30/1/2008,20:35,Cumbernauld (UK/Scotland),Cumbernauld ,#N/A,,Green light flying from right to left stops then shoots upward and away
01/27/2008 19:30,27/1/2008,19:30,Manchester (UK/England),Manchester ,#N/A,,"three bright lights different colours, changing shapes."
01/27/2008 18:53,27/1/2008,18:53,Cheshire (UK/England),Cheshire ,#N/A,,Cheshire UK England.20 seconds(approx) two slowly moving star-like objects moving together then apart before disappearing
01/26/2008 19:20,26/1/2008,19:20,Basingstoke (UK/England),Basingstoke ,#N/A,,ufo basingstoke u.k.
01/25/2008 00:00,25/1/2008,00:00,Plymouth (UK/England),Plymouth ,#N/A,,"just wondered if you seen anything strange in the last couple of days nr your labs and setup ,only a question please get bck to me loud"
01/21/2008 18:00,21/1/2008,18:00,Nottingham (UK/England),Nottingham ,#N/A,,((HOAX??)) The object was travelling at quite high speeds!
01/20/2008 23:00,20/1/2008,23:00,West Kilbride (UK/Scotland),West Kilbride ,#N/A,,"Creamy yellow oval pulsing and hovering over Law hill in west kilbride, Scotland."
